TEST1.sh - test driver for CS157B project
Compile your code
In file included from db.cpp:5:
./db.h:158:3: warning: conversion from string literal to 'char *' is deprecated [-Wc++11-compat-deprecated-writable-strings]
  "int", "char", "varchar", "create", "table", "not", "null", "drop", "list", "schema",
  ^
./db.h:158:10: warning: conversion from string literal to 'char *' is deprecated [-Wc++11-compat-deprecated-writable-strings]
  "int", "char", "varchar", "create", "table", "not", "null", "drop", "list", "schema",
         ^
./db.h:158:18: warning: conversion from string literal to 'char *' is deprecated [-Wc++11-compat-deprecated-writable-strings]
  "int", "char", "varchar", "create", "table", "not", "null", "drop", "list", "schema",
                 ^
./db.h:158:29: warning: conversion from string literal to 'char *' is deprecated [-Wc++11-compat-deprecated-writable-strings]
  "int", "char", "varchar", "create", "table", "not", "null", "drop", "list", "schema",
                            ^
./db.h:158:39: warning: conversion from string literal to 'char *' is deprecated [-Wc++11-compat-deprecated-writable-strings]
  "int", "char", "varchar", "create", "table", "not", "null", "drop", "list", "schema",
                                      ^
./db.h:158:48: warning: conversion from string literal to 'char *' is deprecated [-Wc++11-compat-deprecated-writable-strings]
  "int", "char", "varchar", "create", "table", "not", "null", "drop", "list", "schema",
                                               ^
./db.h:158:55: warning: conversion from string literal to 'char *' is deprecated [-Wc++11-compat-deprecated-writable-strings]
  "int", "char", "varchar", "create", "table", "not", "null", "drop", "list", "schema",
                                                      ^
./db.h:158:63: warning: conversion from string literal to 'char *' is deprecated [-Wc++11-compat-deprecated-writable-strings]
  "int", "char", "varchar", "create", "table", "not", "null", "drop", "list", "schema",
                                                              ^
./db.h:158:71: warning: conversion from string literal to 'char *' is deprecated [-Wc++11-compat-deprecated-writable-strings]
  "int", "char", "varchar", "create", "table", "not", "null", "drop", "list", "schema",
                                                                      ^
./db.h:158:79: warning: conversion from string literal to 'char *' is deprecated [-Wc++11-compat-deprecated-writable-strings]
  "int", "char", "varchar", "create", "table", "not", "null", "drop", "list", "schema",
                                                                              ^
./db.h:159:3: warning: conversion from string literal to 'char *' is deprecated [-Wc++11-compat-deprecated-writable-strings]
  "for", "to", "insert", "into", "values", "delete", "from", "where",
  ^
./db.h:159:10: warning: conversion from string literal to 'char *' is deprecated [-Wc++11-compat-deprecated-writable-strings]
  "for", "to", "insert", "into", "values", "delete", "from", "where",
         ^
./db.h:159:16: warning: conversion from string literal to 'char *' is deprecated [-Wc++11-compat-deprecated-writable-strings]
  "for", "to", "insert", "into", "values", "delete", "from", "where",
               ^
./db.h:159:26: warning: conversion from string literal to 'char *' is deprecated [-Wc++11-compat-deprecated-writable-strings]
  "for", "to", "insert", "into", "values", "delete", "from", "where",
                         ^
./db.h:159:34: warning: conversion from string literal to 'char *' is deprecated [-Wc++11-compat-deprecated-writable-strings]
  "for", "to", "insert", "into", "values", "delete", "from", "where",
                                 ^
./db.h:159:44: warning: conversion from string literal to 'char *' is deprecated [-Wc++11-compat-deprecated-writable-strings]
  "for", "to", "insert", "into", "values", "delete", "from", "where",
                                           ^
./db.h:159:54: warning: conversion from string literal to 'char *' is deprecated [-Wc++11-compat-deprecated-writable-strings]
  "for", "to", "insert", "into", "values", "delete", "from", "where",
                                                     ^
./db.h:159:62: warning: conversion from string literal to 'char *' is deprecated [-Wc++11-compat-deprecated-writable-strings]
  "for", "to", "insert", "into", "values", "delete", "from", "where",
                                                             ^
./db.h:160:3: warning: conversion from string literal to 'char *' is deprecated [-Wc++11-compat-deprecated-writable-strings]
  "update", "set", "select", "order", "by", "desc", "is", "and", "or",
  ^
./db.h:160:13: warning: conversion from string literal to 'char *' is deprecated [-Wc++11-compat-deprecated-writable-strings]
  "update", "set", "select", "order", "by", "desc", "is", "and", "or",
            ^
./db.h:160:20: warning: conversion from string literal to 'char *' is deprecated [-Wc++11-compat-deprecated-writable-strings]
  "update", "set", "select", "order", "by", "desc", "is", "and", "or",
                   ^
./db.h:160:30: warning: conversion from string literal to 'char *' is deprecated [-Wc++11-compat-deprecated-writable-strings]
  "update", "set", "select", "order", "by", "desc", "is", "and", "or",
                             ^
./db.h:160:39: warning: conversion from string literal to 'char *' is deprecated [-Wc++11-compat-deprecated-writable-strings]
  "update", "set", "select", "order", "by", "desc", "is", "and", "or",
                                      ^
./db.h:160:45: warning: conversion from string literal to 'char *' is deprecated [-Wc++11-compat-deprecated-writable-strings]
  "update", "set", "select", "order", "by", "desc", "is", "and", "or",
                                            ^
./db.h:160:53: warning: conversion from string literal to 'char *' is deprecated [-Wc++11-compat-deprecated-writable-strings]
  "update", "set", "select", "order", "by", "desc", "is", "and", "or",
                                                    ^
./db.h:160:59: warning: conversion from string literal to 'char *' is deprecated [-Wc++11-compat-deprecated-writable-strings]
  "update", "set", "select", "order", "by", "desc", "is", "and", "or",
                                                          ^
./db.h:160:66: warning: conversion from string literal to 'char *' is deprecated [-Wc++11-compat-deprecated-writable-strings]
  "update", "set", "select", "order", "by", "desc", "is", "and", "or",
                                                                 ^
./db.h:161:3: warning: conversion from string literal to 'char *' is deprecated [-Wc++11-compat-deprecated-writable-strings]
  "sum", "avg", "count", "backup", "restore", "rollforward", "without", "rf"
  ^
./db.h:161:10: warning: conversion from string literal to 'char *' is deprecated [-Wc++11-compat-deprecated-writable-strings]
  "sum", "avg", "count", "backup", "restore", "rollforward", "without", "rf"
         ^
./db.h:161:17: warning: conversion from string literal to 'char *' is deprecated [-Wc++11-compat-deprecated-writable-strings]
  "sum", "avg", "count", "backup", "restore", "rollforward", "without", "rf"
                ^
./db.h:161:26: warning: conversion from string literal to 'char *' is deprecated [-Wc++11-compat-deprecated-writable-strings]
  "sum", "avg", "count", "backup", "restore", "rollforward", "without", "rf"
                         ^
./db.h:161:36: warning: conversion from string literal to 'char *' is deprecated [-Wc++11-compat-deprecated-writable-strings]
  "sum", "avg", "count", "backup", "restore", "rollforward", "without", "rf"
                                   ^
./db.h:161:47: warning: conversion from string literal to 'char *' is deprecated [-Wc++11-compat-deprecated-writable-strings]
  "sum", "avg", "count", "backup", "restore", "rollforward", "without", "rf"
                                              ^
./db.h:161:62: warning: conversion from string literal to 'char *' is deprecated [-Wc++11-compat-deprecated-writable-strings]
  "sum", "avg", "count", "backup", "restore", "rollforward", "without", "rf"
                                                             ^
./db.h:161:73: warning: conversion from string literal to 'char *' is deprecated [-Wc++11-compat-deprecated-writable-strings]
  "sum", "avg", "count", "backup", "restore", "rollforward", "without", "rf"
                                                                        ^
db.cpp:213:28: warning: conversion from string literal to 'char *' is deprecated [-Wc++11-compat-deprecated-writable-strings]
                                        add_to_list(tok_list, "", terminator, EOC);
                                                              ^
db.cpp:243:28: warning: conversion from string literal to 'char *' is deprecated [-Wc++11-compat-deprecated-writable-strings]
                                        add_to_list(tok_list, "", terminator, EOC);
                                                              ^
db.cpp:270:27: warning: conversion from string literal to 'char *' is deprecated [-Wc++11-compat-deprecated-writable-strings]
                                add_to_list(tok_list, "", terminator, EOC);
                                                      ^
db.cpp:300:28: warning: conversion from string literal to 'char *' is deprecated [-Wc++11-compat-deprecated-writable-strings]
                                        add_to_list(tok_list, "", terminator, EOC);
                                                              ^
db.cpp:309:27: warning: conversion from string literal to 'char *' is deprecated [-Wc++11-compat-deprecated-writable-strings]
                                add_to_list(tok_list, "", terminator, EOC);
                                                      ^
db.cpp:746:36: warning: format specifies type 'int' but the argument has type 'off_t' (aka 'long long') [-Wformat]
                printf("dbfile.bin size = %d\n", file_stat.st_size);
                                          ~~     ^~~~~~~~~~~~~~~~~
                                          %lld
db.cpp:2212:37: warning: conversion from string literal to 'char *' is deprecated [-Wc++11-compat-deprecated-writable-strings]
                        char *end = ")";
                                    ^
db.cpp:2213:39: warning: conversion from string literal to 'char *' is deprecated [-Wc++11-compat-deprecated-writable-strings]
                        char *start = "";
                                      ^
db.cpp:2216:38: warning: conversion from string literal to 'char *' is deprecated [-Wc++11-compat-deprecated-writable-strings]
                             start = "SUM(";
                                     ^
db.cpp:2219:38: warning: conversion from string literal to 'char *' is deprecated [-Wc++11-compat-deprecated-writable-strings]
                             start = "COUNT(";
                                     ^
db.cpp:2222:38: warning: conversion from string literal to 'char *' is deprecated [-Wc++11-compat-deprecated-writable-strings]
                             start = "AVG(";
                                     ^
46 warnings generated.
Clean up
rm: dbfile.bin: No such file or directory
rm: *.tab: No such file or directory
==========================================================================================
01 Test setup - create table + insert data
          create 	1 	 13
           table 	1 	 14
           class 	2 	 85
               ( 	3 	 70
    Student_Name 	2 	 85
            char 	4 	 11
               ( 	3 	 70
              20 	5 	 90
               ) 	3 	 71
             NOT 	1 	 15
            NULL 	1 	 16
               , 	3 	 72
          Gender 	2 	 85
            char 	4 	 11
               ( 	3 	 70
               1 	5 	 90
               ) 	3 	 71
               , 	3 	 72
           Exams 	2 	 85
             int 	4 	 10
               , 	3 	 72
      Quiz_Total 	2 	 85
             int 	4 	 10
               , 	3 	 72
           Total 	2 	 85
             int 	4 	 10
             NOT 	1 	 15
            NULL 	1 	 16
               ) 	3 	 71
                 	7 	 95
CREATE TABLE statement
==========================================================================================
02 Insert 15 rows of data
dbfile.bin size = 228
          insert 	1 	 22
            into 	1 	 23
           class 	2 	 85
          values 	1 	 24
               ( 	3 	 70
             Siu 	5 	 91
               , 	3 	 72
               M 	5 	 91
               , 	3 	 72
             480 	5 	 90
               , 	3 	 72
              80 	5 	 90
               , 	3 	 72
             560 	5 	 90
               ) 	3 	 71
                 	7 	 95
INSERT statement
class.tab size: 64. Number of records: 1
dbfile.bin size = 228
          insert 	1 	 22
            into 	1 	 23
           class 	2 	 85
          values 	1 	 24
               ( 	3 	 70
           Frank 	5 	 91
               , 	3 	 72
               M 	5 	 91
               , 	3 	 72
             600 	5 	 90
               , 	3 	 72
             100 	5 	 90
               , 	3 	 72
             700 	5 	 90
               ) 	3 	 71
                 	7 	 95
INSERT statement
class.tab size: 104. Number of records: 2
dbfile.bin size = 228
          insert 	1 	 22
            into 	1 	 23
           class 	2 	 85
          values 	1 	 24
               ( 	3 	 70
          Jordon 	5 	 91
               , 	3 	 72
               M 	5 	 91
               , 	3 	 72
             450 	5 	 90
               , 	3 	 72
              75 	5 	 90
               , 	3 	 72
             525 	5 	 90
               ) 	3 	 71
                 	7 	 95
INSERT statement
class.tab size: 144. Number of records: 3
dbfile.bin size = 228
          insert 	1 	 22
            into 	1 	 23
           class 	2 	 85
          values 	1 	 24
               ( 	3 	 70
            Jeff 	5 	 91
               , 	3 	 72
               M 	5 	 91
               , 	3 	 72
             455 	5 	 90
               , 	3 	 72
              60 	5 	 90
               , 	3 	 72
             515 	5 	 90
               ) 	3 	 71
                 	7 	 95
INSERT statement
class.tab size: 184. Number of records: 4
dbfile.bin size = 228
          insert 	1 	 22
            into 	1 	 23
           class 	2 	 85
          values 	1 	 24
               ( 	3 	 70
            Ying 	5 	 91
               , 	3 	 72
               F 	5 	 91
               , 	3 	 72
             540 	5 	 90
               , 	3 	 72
              85 	5 	 90
               , 	3 	 72
             625 	5 	 90
               ) 	3 	 71
                 	7 	 95
INSERT statement
class.tab size: 224. Number of records: 5
dbfile.bin size = 228
          insert 	1 	 22
            into 	1 	 23
           class 	2 	 85
          values 	1 	 24
               ( 	3 	 70
           David 	5 	 91
               , 	3 	 72
               M 	5 	 91
               , 	3 	 72
             550 	5 	 90
               , 	3 	 72
              83 	5 	 90
               , 	3 	 72
             633 	5 	 90
               ) 	3 	 71
                 	7 	 95
INSERT statement
class.tab size: 264. Number of records: 6
dbfile.bin size = 228
          insert 	1 	 22
            into 	1 	 23
           class 	2 	 85
          values 	1 	 24
               ( 	3 	 70
            euna 	5 	 91
               , 	3 	 72
               F 	5 	 91
               , 	3 	 72
             620 	5 	 90
               , 	3 	 72
              90 	5 	 90
               , 	3 	 72
             535 	5 	 90
               ) 	3 	 71
                 	7 	 95
INSERT statement
class.tab size: 304. Number of records: 7
dbfile.bin size = 228
          insert 	1 	 22
            into 	1 	 23
           class 	2 	 85
          values 	1 	 24
               ( 	3 	 70
          Victor 	5 	 91
               , 	3 	 72
               M 	5 	 91
               , 	3 	 72
             475 	5 	 90
               , 	3 	 72
              60 	5 	 90
               , 	3 	 72
             535 	5 	 90
               ) 	3 	 71
                 	7 	 95
INSERT statement
class.tab size: 344. Number of records: 8
dbfile.bin size = 228
          insert 	1 	 22
            into 	1 	 23
           class 	2 	 85
          values 	1 	 24
               ( 	3 	 70
        Linawati 	5 	 91
               , 	3 	 72
               F 	5 	 91
               , 	3 	 72
             490 	5 	 90
               , 	3 	 72
              86 	5 	 90
               , 	3 	 72
             576 	5 	 90
               ) 	3 	 71
                 	7 	 95
INSERT statement
class.tab size: 384. Number of records: 9
dbfile.bin size = 228
          insert 	1 	 22
            into 	1 	 23
           class 	2 	 85
          values 	1 	 24
               ( 	3 	 70
         Stephen 	5 	 91
               , 	3 	 72
               M 	5 	 91
               , 	3 	 72
             520 	5 	 90
               , 	3 	 72
              76 	5 	 90
               , 	3 	 72
             596 	5 	 90
               ) 	3 	 71
                 	7 	 95
INSERT statement
class.tab size: 424. Number of records: 10
dbfile.bin size = 228
          insert 	1 	 22
            into 	1 	 23
           class 	2 	 85
          values 	1 	 24
               ( 	3 	 70
          Melody 	5 	 91
               , 	3 	 72
               F 	5 	 91
               , 	3 	 72
             560 	5 	 90
               , 	3 	 72
              83 	5 	 90
               , 	3 	 72
             633 	5 	 90
               ) 	3 	 71
                 	7 	 95
INSERT statement
class.tab size: 464. Number of records: 11
dbfile.bin size = 228
          insert 	1 	 22
            into 	1 	 23
           class 	2 	 85
          values 	1 	 24
               ( 	3 	 70
          Travis 	5 	 91
               , 	3 	 72
               M 	5 	 91
               , 	3 	 72
             600 	5 	 90
               , 	3 	 72
              75 	5 	 90
               , 	3 	 72
             534 	5 	 90
               ) 	3 	 71
                 	7 	 95
INSERT statement
class.tab size: 504. Number of records: 12
dbfile.bin size = 228
          insert 	1 	 22
            into 	1 	 23
           class 	2 	 85
          values 	1 	 24
               ( 	3 	 70
          Sherry 	5 	 91
               , 	3 	 72
               F 	5 	 91
               , 	3 	 72
             610 	5 	 90
               , 	3 	 72
              94 	5 	 90
               , 	3 	 72
             647 	5 	 90
               ) 	3 	 71
                 	7 	 95
INSERT statement
class.tab size: 544. Number of records: 13
dbfile.bin size = 228
          insert 	1 	 22
            into 	1 	 23
           class 	2 	 85
          values 	1 	 24
               ( 	3 	 70
          Hector 	5 	 91
               , 	3 	 72
               M 	5 	 91
               , 	3 	 72
             590 	5 	 90
               , 	3 	 72
              86 	5 	 90
               , 	3 	 72
             482 	5 	 90
               ) 	3 	 71
                 	7 	 95
INSERT statement
class.tab size: 584. Number of records: 14
dbfile.bin size = 228
          insert 	1 	 22
            into 	1 	 23
           class 	2 	 85
          values 	1 	 24
               ( 	3 	 70
         Natalie 	5 	 91
               , 	3 	 72
               F 	5 	 91
               , 	3 	 72
             500 	5 	 90
               , 	3 	 72
              54 	5 	 90
               , 	3 	 72
             596 	5 	 90
               ) 	3 	 71
                 	7 	 95
INSERT statement
class.tab size: 624. Number of records: 15
==========================================================================================
SIMPLE SELECT
==========================================================================================
Select All
Simple select & verify headings & verify NULL display with
dbfile.bin size = 228
          select 	1 	 30
               * 	3 	 73
            from 	1 	 26
           class 	2 	 85
                 	7 	 95
SELECT statement
+----------------+----------------+----------------+----------------+----------------+
|Student_Name    |Gender          |Exams           |Quiz_Total      |Total           |
+----------------+----------------+----------------+----------------+----------------+
|Siu             |M               |             480|              80|             560|
|Frank           |M               |             600|             100|             700|
|Jordon          |M               |             450|              75|             525|
|Jeff            |M               |             455|              60|             515|
|Ying            |F               |             540|              85|             625|
|David           |M               |             550|              83|             633|
|euna            |F               |             620|              90|             535|
|Victor          |M               |             475|              60|             535|
|Linawati        |F               |             490|              86|             576|
|Stephen         |M               |             520|              76|             596|
|Melody          |F               |             560|              83|             633|
|Travis          |M               |             600|              75|             534|
|Sherry          |F               |             610|              94|             647|
|Hector          |M               |             590|              86|             482|
|Natalie         |F               |             500|              54|             596|
+----------------+----------------+----------------+----------------+----------------+
15 rows selected.

------------------------------------------------------------------------------------------
Projection
select Student_Name from class
dbfile.bin size = 228
          select 	1 	 30
    Student_Name 	2 	 85
            from 	1 	 26
           class 	2 	 85
                 	7 	 95
SELECT statement
+----------------+
|Student_Name    |
+----------------+
|Siu             |
|Frank           |
|Jordon          |
|Jeff            |
|Ying            |
|David           |
|euna            |
|Victor          |
|Linawati        |
|Stephen         |
|Melody          |
|Travis          |
|Sherry          |
|Hector          |
|Natalie         |
+----------------+
15 rows selected.

------------------------------------------------------------------------------------------
Projection
select Student_Name, Quiz_Total from class
dbfile.bin size = 228
          select 	1 	 30
    Student_Name 	2 	 85
               , 	3 	 72
      Quiz_Total 	2 	 85
            from 	1 	 26
           class 	2 	 85
                 	7 	 95
SELECT statement
+----------------+----------------+
|Student_Name    |Quiz_Total      |
+----------------+----------------+
|Siu             |              80|
|Frank           |             100|
|Jordon          |              75|
|Jeff            |              60|
|Ying            |              85|
|David           |              83|
|euna            |              90|
|Victor          |              60|
|Linawati        |              86|
|Stephen         |              76|
|Melody          |              83|
|Travis          |              75|
|Sherry          |              94|
|Hector          |              86|
|Natalie         |              54|
+----------------+----------------+
15 rows selected.

==========================================================================================
DELETE
==========================================================================================
Delete from class where Student_Name = Bad_Student
delete from class where Student_Name = Stephen
dbfile.bin size = 228
          delete 	1 	 25
            from 	1 	 26
           class 	2 	 85
           where 	1 	 27
    Student_Name 	2 	 85
               = 	3 	 74
         Stephen 	5 	 91
                 	7 	 95
DELETE statement
Delete 1 rows. 
dbfile.bin size = 228
          select 	1 	 30
               * 	3 	 73
            from 	1 	 26
           class 	2 	 85
                 	7 	 95
SELECT statement
+----------------+----------------+----------------+----------------+----------------+
|Student_Name    |Gender          |Exams           |Quiz_Total      |Total           |
+----------------+----------------+----------------+----------------+----------------+
|Siu             |M               |             480|              80|             560|
|Frank           |M               |             600|             100|             700|
|Jordon          |M               |             450|              75|             525|
|Jeff            |M               |             455|              60|             515|
|Ying            |F               |             540|              85|             625|
|David           |M               |             550|              83|             633|
|euna            |F               |             620|              90|             535|
|Victor          |M               |             475|              60|             535|
|Linawati        |F               |             490|              86|             576|
|Natalie         |F               |             500|              54|             596|
|Melody          |F               |             560|              83|             633|
|Travis          |M               |             600|              75|             534|
|Sherry          |F               |             610|              94|             647|
|Hector          |M               |             590|              86|             482|
+----------------+----------------+----------------+----------------+----------------+
14 rows selected.

------------------------------------------------------------------------------------------
Delete from class where no row is found
delete from class where Student_Name = 'Hi'
dbfile.bin size = 228
          delete 	1 	 25
            from 	1 	 26
           class 	2 	 85
           where 	1 	 27
    Student_Name 	2 	 85
               = 	3 	 74
              Hi 	5 	 91
                 	7 	 95
DELETE statement
WARNING: Delete 0 rows. 
dbfile.bin size = 228
          select 	1 	 30
               * 	3 	 73
            from 	1 	 26
           class 	2 	 85
                 	7 	 95
SELECT statement
+----------------+----------------+----------------+----------------+----------------+
|Student_Name    |Gender          |Exams           |Quiz_Total      |Total           |
+----------------+----------------+----------------+----------------+----------------+
|Siu             |M               |             480|              80|             560|
|Frank           |M               |             600|             100|             700|
|Jordon          |M               |             450|              75|             525|
|Jeff            |M               |             455|              60|             515|
|Ying            |F               |             540|              85|             625|
|David           |M               |             550|              83|             633|
|euna            |F               |             620|              90|             535|
|Victor          |M               |             475|              60|             535|
|Linawati        |F               |             490|              86|             576|
|Natalie         |F               |             500|              54|             596|
|Melody          |F               |             560|              83|             633|
|Travis          |M               |             600|              75|             534|
|Sherry          |F               |             610|              94|             647|
|Hector          |M               |             590|              86|             482|
+----------------+----------------+----------------+----------------+----------------+
14 rows selected.

------------------------------------------------------------------------------------------
Delete multi-row 3 rows
delete from class where Exams < 500
dbfile.bin size = 228
          delete 	1 	 25
            from 	1 	 26
           class 	2 	 85
           where 	1 	 27
           Exams 	2 	 85
               < 	3 	 75
             500 	5 	 90
                 	7 	 95
DELETE statement
Delete 5 rows. 
dbfile.bin size = 228
          select 	1 	 30
               * 	3 	 73
            from 	1 	 26
           class 	2 	 85
                 	7 	 95
SELECT statement
+----------------+----------------+----------------+----------------+----------------+
|Student_Name    |Gender          |Exams           |Quiz_Total      |Total           |
+----------------+----------------+----------------+----------------+----------------+
|Hector          |M               |             590|              86|             482|
|Frank           |M               |             600|             100|             700|
|Sherry          |F               |             610|              94|             647|
|Travis          |M               |             600|              75|             534|
|Ying            |F               |             540|              85|             625|
|David           |M               |             550|              83|             633|
|euna            |F               |             620|              90|             535|
|Melody          |F               |             560|              83|             633|
|Natalie         |F               |             500|              54|             596|
+----------------+----------------+----------------+----------------+----------------+
9 rows selected.

==========================================================================================
UPDATE
==========================================================================================
Test single row update, e.g. update class set Quiz_Total=350 where Student_Name=’David’
update class set Quiz_Total = 350 where Student_Name = 'Natalie'
dbfile.bin size = 228
          update 	1 	 28
           class 	2 	 85
             set 	1 	 29
      Quiz_Total 	2 	 85
               = 	3 	 74
             350 	5 	 90
           where 	1 	 27
    Student_Name 	2 	 85
               = 	3 	 74
         Natalie 	5 	 91
                 	7 	 95
UPDATE statement
Updated 1 rows.
dbfile.bin size = 228
          select 	1 	 30
               * 	3 	 73
            from 	1 	 26
           class 	2 	 85
                 	7 	 95
SELECT statement
+----------------+----------------+----------------+----------------+----------------+
|Student_Name    |Gender          |Exams           |Quiz_Total      |Total           |
+----------------+----------------+----------------+----------------+----------------+
|Hector          |M               |             590|              86|             482|
|Frank           |M               |             600|             100|             700|
|Sherry          |F               |             610|              94|             647|
|Travis          |M               |             600|              75|             534|
|Ying            |F               |             540|              85|             625|
|David           |M               |             550|              83|             633|
|euna            |F               |             620|              90|             535|
|Melody          |F               |             560|              83|             633|
|Natalie         |F               |             500|             350|             596|
+----------------+----------------+----------------+----------------+----------------+
9 rows selected.

------------------------------------------------------------------------------------------
Test update when no rows is found
update class set Quiz_Total = 350 where Student_Name = 'Nhu'
dbfile.bin size = 228
          update 	1 	 28
           class 	2 	 85
             set 	1 	 29
      Quiz_Total 	2 	 85
               = 	3 	 74
             350 	5 	 90
           where 	1 	 27
    Student_Name 	2 	 85
               = 	3 	 74
             Nhu 	5 	 91
                 	7 	 95
UPDATE statement
WARNING: Updated 0 rows.
dbfile.bin size = 228
          select 	1 	 30
               * 	3 	 73
            from 	1 	 26
           class 	2 	 85
                 	7 	 95
SELECT statement
+----------------+----------------+----------------+----------------+----------------+
|Student_Name    |Gender          |Exams           |Quiz_Total      |Total           |
+----------------+----------------+----------------+----------------+----------------+
|Hector          |M               |             590|              86|             482|
|Frank           |M               |             600|             100|             700|
|Sherry          |F               |             610|              94|             647|
|Travis          |M               |             600|              75|             534|
|Ying            |F               |             540|              85|             625|
|David           |M               |             550|              83|             633|
|euna            |F               |             620|              90|             535|
|Melody          |F               |             560|              83|             633|
|Natalie         |F               |             500|             350|             596|
+----------------+----------------+----------------+----------------+----------------+
9 rows selected.

------------------------------------------------------------------------------------------
Multi-row update 4 rows
update class set Quiz_Total = 200 where Quiz_Total < 85
dbfile.bin size = 228
          update 	1 	 28
           class 	2 	 85
             set 	1 	 29
      Quiz_Total 	2 	 85
               = 	3 	 74
             200 	5 	 90
           where 	1 	 27
      Quiz_Total 	2 	 85
               < 	3 	 75
              85 	5 	 90
                 	7 	 95
UPDATE statement
Updated 3 rows.
dbfile.bin size = 228
          select 	1 	 30
               * 	3 	 73
            from 	1 	 26
           class 	2 	 85
                 	7 	 95
SELECT statement
+----------------+----------------+----------------+----------------+----------------+
|Student_Name    |Gender          |Exams           |Quiz_Total      |Total           |
+----------------+----------------+----------------+----------------+----------------+
|Hector          |M               |             590|              86|             482|
|Frank           |M               |             600|             100|             700|
|Sherry          |F               |             610|              94|             647|
|Travis          |M               |             600|             200|             534|
|Ying            |F               |             540|              85|             625|
|David           |M               |             550|             200|             633|
|euna            |F               |             620|              90|             535|
|Melody          |F               |             560|             200|             633|
|Natalie         |F               |             500|             350|             596|
+----------------+----------------+----------------+----------------+----------------+
9 rows selected.

==========================================================================================
COMPLEX SELECT
==========================================================================================
Test SELECT with WHERE clause with a single condition.
select * from class where Exams < 600
dbfile.bin size = 228
          select 	1 	 30
               * 	3 	 73
            from 	1 	 26
           class 	2 	 85
           where 	1 	 27
           Exams 	2 	 85
               < 	3 	 75
             600 	5 	 90
                 	7 	 95
SELECT statement
+----------------+----------------+----------------+----------------+----------------+
|Student_Name    |Gender          |Exams           |Quiz_Total      |Total           |
+----------------+----------------+----------------+----------------+----------------+
|Hector          |M               |             590|              86|             482|
|Ying            |F               |             540|              85|             625|
|David           |M               |             550|             200|             633|
|Melody          |F               |             560|             200|             633|
|Natalie         |F               |             500|             350|             596|
+----------------+----------------+----------------+----------------+----------------+
5 rows selected.

Test SELECT with WHERE clause with a single condition.
select Student_Name from class where Exams < 600
dbfile.bin size = 228
          select 	1 	 30
    Student_Name 	2 	 85
            from 	1 	 26
           class 	2 	 85
           where 	1 	 27
           Exams 	2 	 85
               < 	3 	 75
             600 	5 	 90
                 	7 	 95
SELECT statement
+----------------+
|Student_Name    |
+----------------+
|Hector          |
|Ying            |
|David           |
|Melody          |
|Natalie         |
+----------------+
5 rows selected.

------------------------------------------------------------------------------------------
Test SELECT with WHERE clause for case sensitive comparison, e.g. Student_Name < 'Good_Student'
Nhu: There is a bug. I will fix mine to validate these stuffs earlier! 
select * from class where Student_Name < 'Frank'
dbfile.bin size = 228
          select 	1 	 30
               * 	3 	 73
            from 	1 	 26
           class 	2 	 85
           where 	1 	 27
    Student_Name 	2 	 85
               < 	3 	 75
           Frank 	5 	 91
                 	7 	 95
SELECT statement
+----------------+----------------+----------------+----------------+----------------+
|Student_Name    |Gender          |Exams           |Quiz_Total      |Total           |
+----------------+----------------+----------------+----------------+----------------+
|David           |M               |             550|             200|             633|
+----------------+----------------+----------------+----------------+----------------+
1 rows selected.

select * from class where Student_Name = 'frank'
dbfile.bin size = 228
          select 	1 	 30
               * 	3 	 73
            from 	1 	 26
           class 	2 	 85
           where 	1 	 27
    Student_Name 	2 	 85
               = 	3 	 74
           frank 	5 	 91
                 	7 	 95
SELECT statement
+----------------+----------------+----------------+----------------+----------------+
|Student_Name    |Gender          |Exams           |Quiz_Total      |Total           |
+----------------+----------------+----------------+----------------+----------------+
+----------------+----------------+----------------+----------------+----------------+
0 rows selected.

------------------------------------------------------------------------------------------
Test SELECT with WHERE clause with columns that is NULL and NOT NULL
update class set Quiz_Total = NULL where Student_Name = 'Natalie'
dbfile.bin size = 228
          update 	1 	 28
           class 	2 	 85
             set 	1 	 29
           Exams 	2 	 85
               = 	3 	 74
            NULL 	1 	 16
           where 	1 	 27
    Student_Name 	2 	 85
               = 	3 	 74
         Natalie 	5 	 91
                 	7 	 95
UPDATE statement
Updated 1 rows.

select Student_Name, Gender from class where Exams IS NULL
dbfile.bin size = 228
          select 	1 	 30
    Student_Name 	2 	 85
               , 	3 	 72
          Gender 	2 	 85
            from 	1 	 26
           class 	2 	 85
           where 	1 	 27
           Exams 	2 	 85
              IS 	1 	 34
            NULL 	1 	 16
                 	7 	 95
SELECT statement
+----------------+----------------+
|Student_Name    |Gender          |
+----------------+----------------+
|Natalie         |F               |
+----------------+----------------+
1 rows selected.

------------------------------------------------------------------------------------------
Test SELECT with two conditions separated by the AND keyword.
select * from class where Total > 400 AND Exams IS NULL
dbfile.bin size = 228
          select 	1 	 30
               * 	3 	 73
            from 	1 	 26
           class 	2 	 85
           where 	1 	 27
           Total 	2 	 85
               > 	3 	 76
             400 	5 	 90
             AND 	1 	 35
           Exams 	2 	 85
              IS 	1 	 34
            NULL 	1 	 16
                 	7 	 95
SELECT statement
+----------------+----------------+----------------+----------------+----------------+
|Student_Name    |Gender          |Exams           |Quiz_Total      |Total           |
+----------------+----------------+----------------+----------------+----------------+
|Natalie         |F               |               -|             350|             596|
+----------------+----------------+----------------+----------------+----------------+
1 rows selected.

------------------------------------------------------------------------------------------
Test SELECT with two conditions separated by the OR keyword
select * from class where Exams IS NULL OR Student_Name ='Frank'
dbfile.bin size = 228
          select 	1 	 30
               * 	3 	 73
            from 	1 	 26
           class 	2 	 85
           where 	1 	 27
           Exams 	2 	 85
              IS 	1 	 34
            NULL 	1 	 16
              OR 	1 	 36
    Student_Name 	2 	 85
               = 	3 	 74
           Frank 	5 	 91
                 	7 	 95
SELECT statement
+----------------+----------------+----------------+----------------+----------------+
|Student_Name    |Gender          |Exams           |Quiz_Total      |Total           |
+----------------+----------------+----------------+----------------+----------------+
|Frank           |M               |             600|             100|             700|
|Natalie         |F               |               -|             350|             596|
+----------------+----------------+----------------+----------------+----------------+
2 rows selected.

------------------------------------------------------------------------------------------
Test SELECT with ORDER BY clause.
select * from class ORDER BY Student_Name DESC
dbfile.bin size = 228
          select 	1 	 30
               * 	3 	 73
            from 	1 	 26
           class 	2 	 85
           ORDER 	1 	 31
              BY 	1 	 32
    Student_Name 	2 	 85
            DESC 	1 	 33
                 	7 	 95
SELECT statement
+----------------+----------------+----------------+----------------+----------------+
|Student_Name    |Gender          |Exams           |Quiz_Total      |Total           |
+----------------+----------------+----------------+----------------+----------------+
|euna            |F               |             620|              90|             535|
|Ying            |F               |             540|              85|             625|
|Travis          |M               |             600|             200|             534|
|Sherry          |F               |             610|              94|             647|
|Natalie         |F               |               -|             350|             596|
|Melody          |F               |             560|             200|             633|
|Hector          |M               |             590|              86|             482|
|Frank           |M               |             600|             100|             700|
|David           |M               |             550|             200|             633|
+----------------+----------------+----------------+----------------+----------------+
9 rows selected.

select * from class ORDER BY Student_Name
dbfile.bin size = 228
          select 	1 	 30
               * 	3 	 73
            from 	1 	 26
           class 	2 	 85
           ORDER 	1 	 31
              BY 	1 	 32
    Student_Name 	2 	 85
                 	7 	 95
SELECT statement
+----------------+----------------+----------------+----------------+----------------+
|Student_Name    |Gender          |Exams           |Quiz_Total      |Total           |
+----------------+----------------+----------------+----------------+----------------+
|David           |M               |             550|             200|             633|
|Frank           |M               |             600|             100|             700|
|Hector          |M               |             590|              86|             482|
|Melody          |F               |             560|             200|             633|
|Natalie         |F               |               -|             350|             596|
|Sherry          |F               |             610|              94|             647|
|Travis          |M               |             600|             200|             534|
|Ying            |F               |             540|              85|             625|
|euna            |F               |             620|              90|             535|
+----------------+----------------+----------------+----------------+----------------+
9 rows selected.

select * from class ORDER BY Exams DESC
dbfile.bin size = 228
          select 	1 	 30
               * 	3 	 73
            from 	1 	 26
           class 	2 	 85
           ORDER 	1 	 31
              BY 	1 	 32
           Exams 	2 	 85
            DESC 	1 	 33
                 	7 	 95
SELECT statement
+----------------+----------------+----------------+----------------+----------------+
|Student_Name    |Gender          |Exams           |Quiz_Total      |Total           |
+----------------+----------------+----------------+----------------+----------------+
|euna            |F               |             620|              90|             535|
|Sherry          |F               |             610|              94|             647|
|Frank           |M               |             600|             100|             700|
|Travis          |M               |             600|             200|             534|
|Hector          |M               |             590|              86|             482|
|Melody          |F               |             560|             200|             633|
|David           |M               |             550|             200|             633|
|Ying            |F               |             540|              85|             625|
|Natalie         |F               |               -|             350|             596|
+----------------+----------------+----------------+----------------+----------------+
9 rows selected.

select * from class ORDER BY Exams
dbfile.bin size = 228
          select 	1 	 30
               * 	3 	 73
            from 	1 	 26
           class 	2 	 85
           ORDER 	1 	 31
              BY 	1 	 32
           Exams 	2 	 85
                 	7 	 95
SELECT statement
+----------------+----------------+----------------+----------------+----------------+
|Student_Name    |Gender          |Exams           |Quiz_Total      |Total           |
+----------------+----------------+----------------+----------------+----------------+
|Ying            |F               |             540|              85|             625|
|David           |M               |             550|             200|             633|
|Melody          |F               |             560|             200|             633|
|Hector          |M               |             590|              86|             482|
|Frank           |M               |             600|             100|             700|
|Travis          |M               |             600|             200|             534|
|Sherry          |F               |             610|              94|             647|
|euna            |F               |             620|              90|             535|
|Natalie         |F               |               -|             350|             596|
+----------------+----------------+----------------+----------------+----------------+
9 rows selected.

------------------------------------------------------------------------------------------
Test SELECT with WHERE and ORDER BY clause.
select * from class WHERE Student_Name = 'Siu' Or Quiz_Total > 80 ORDER BY Quiz_Total
dbfile.bin size = 228
          select 	1 	 30
               * 	3 	 73
            from 	1 	 26
           class 	2 	 85
           WHERE 	1 	 27
    Student_Name 	2 	 85
               = 	3 	 74
             Siu 	5 	 91
              Or 	1 	 36
      Quiz_Total 	2 	 85
               > 	3 	 76
              80 	5 	 90
           ORDER 	1 	 31
              BY 	1 	 32
      Quiz_Total 	2 	 85
                 	7 	 95
SELECT statement
+----------------+----------------+----------------+----------------+----------------+
|Student_Name    |Gender          |Exams           |Quiz_Total      |Total           |
+----------------+----------------+----------------+----------------+----------------+
|Ying            |F               |             540|              85|             625|
|Hector          |M               |             590|              86|             482|
|euna            |F               |             620|              90|             535|
|Sherry          |F               |             610|              94|             647|
|Frank           |M               |             600|             100|             700|
|Travis          |M               |             600|             200|             534|
|David           |M               |             550|             200|             633|
|Melody          |F               |             560|             200|             633|
|Natalie         |F               |               -|             350|             596|
+----------------+----------------+----------------+----------------+----------------+
9 rows selected.

------------------------------------------------------------------------------------------
Test SELECT SUM() function.
SELECT SUM(Exams) FROM CLASS
dbfile.bin size = 228
          SELECT 	1 	 30
             SUM 	6 	 37
               ( 	3 	 70
           Exams 	2 	 85
               ) 	3 	 71
            FROM 	1 	 26
           CLASS 	2 	 85
                 	7 	 95
SELECT statement
+----------------+
|SUM(Exams)      |
+----------------+
|            4670|
+----------------+
1 rows selected.

------------------------------------------------------------------------------------------
Test SELECT SUM() function with WHERE clause
SELECT SUM(Exams) from class WHERE Gender='F'
dbfile.bin size = 228
          SELECT 	1 	 30
             SUM 	6 	 37
               ( 	3 	 70
           Exams 	2 	 85
               ) 	3 	 71
            from 	1 	 26
           class 	2 	 85
           WHERE 	1 	 27
          Gender 	2 	 85
               = 	3 	 74
               F 	5 	 91
                 	7 	 95
SELECT statement
+----------------+
|SUM(Exams)      |
+----------------+
|            2330|
+----------------+
1 rows selected.

------------------------------------------------------------------------------------------
Test SELECT AVG() function
SELECT AVG(Exams) FROM CLASS
dbfile.bin size = 228
          SELECT 	1 	 30
             AVG 	6 	 38
               ( 	3 	 70
           Exams 	2 	 85
               ) 	3 	 71
            FROM 	1 	 26
           CLASS 	2 	 85
                 	7 	 95
SELECT statement
+----------------+
|AVG(Exams)      |
+----------------+
|          583.75|
+----------------+
1 rows selected.

SELECT AVG(Total) FROM CLASS
dbfile.bin size = 228
          SELECT 	1 	 30
             AVG 	6 	 38
               ( 	3 	 70
           Total 	2 	 85
               ) 	3 	 71
            FROM 	1 	 26
           CLASS 	2 	 85
                 	7 	 95
SELECT statement
+----------------+
|AVG(Total)      |
+----------------+
|          598.33|
+----------------+
1 rows selected.

------------------------------------------------------------------------------------------
Test SELECT AVG() function with WHERE clause
SELECT AVG(Total) FROM CLASS WHERE GENDER = 'M'
dbfile.bin size = 228
          SELECT 	1 	 30
             AVG 	6 	 38
               ( 	3 	 70
           Total 	2 	 85
               ) 	3 	 71
            FROM 	1 	 26
           CLASS 	2 	 85
           WHERE 	1 	 27
          GENDER 	2 	 85
               = 	3 	 74
               M 	5 	 91
                 	7 	 95
SELECT statement
+----------------+
|AVG(Total)      |
+----------------+
|          587.25|
+----------------+
1 rows selected.

SELECT AVG(Total) FROM CLASS WHERE GENDER = 'f'
dbfile.bin size = 228
          SELECT 	1 	 30
             AVG 	6 	 38
               ( 	3 	 70
           Total 	2 	 85
               ) 	3 	 71
            FROM 	1 	 26
           CLASS 	2 	 85
           WHERE 	1 	 27
          GENDER 	2 	 85
               = 	3 	 74
               f 	5 	 91
                 	7 	 95
SELECT statement
+----------------+
|AVG(Total)      |
+----------------+
|               -|
+----------------+
1 rows selected.

------------------------------------------------------------------------------------------
Test SELECT COUNT() function
SELECT COUNT(Exams) FROM CLASS
dbfile.bin size = 228
          SELECT 	1 	 30
           COUNT 	6 	 39
               ( 	3 	 70
           Exams 	2 	 85
               ) 	3 	 71
            FROM 	1 	 26
           CLASS 	2 	 85
                 	7 	 95
SELECT statement
+----------------+
|COUNT(Exams)    |
+----------------+
|               8|
+----------------+
1 rows selected.

------------------------------------------------------------------------------------------
Test SELECT COUNT() function with WHERE clause
SELECT COUNT(Exams) FROM CLASS WHERE GENDER = 'M'
dbfile.bin size = 228
          SELECT 	1 	 30
           COUNT 	6 	 39
               ( 	3 	 70
           Exams 	2 	 85
               ) 	3 	 71
            FROM 	1 	 26
           CLASS 	2 	 85
           WHERE 	1 	 27
          GENDER 	2 	 85
               = 	3 	 74
               M 	5 	 91
                 	7 	 95
SELECT statement
+----------------+
|COUNT(Exams)    |
+----------------+
|               4|
+----------------+
1 rows selected.

------------------------------------------------------------------------------------------
Test SUM(), AVG() when there are NULLs
--------WHEN THERE ARE NULLS----------
SELECT SUM(Exams) FROM CLASS
dbfile.bin size = 228
          SELECT 	1 	 30
             SUM 	6 	 37
               ( 	3 	 70
           Exams 	2 	 85
               ) 	3 	 71
            FROM 	1 	 26
           CLASS 	2 	 85
                 	7 	 95
SELECT statement
+----------------+
|SUM(Exams)      |
+----------------+
|            4670|
+----------------+
1 rows selected.

SELECT AVG(Exams) FROM CLASS
dbfile.bin size = 228
          SELECT 	1 	 30
             AVG 	6 	 38
               ( 	3 	 70
           Exams 	2 	 85
               ) 	3 	 71
            FROM 	1 	 26
           CLASS 	2 	 85
                 	7 	 95
SELECT statement
+----------------+
|AVG(Exams)      |
+----------------+
|          583.75|
+----------------+
1 rows selected.

UPDATE CLASS SET EXAMS = 600 WHERE STUDENT_NAME = 'Natalie'
dbfile.bin size = 228
          UPDATE 	1 	 28
           CLASS 	2 	 85
             SET 	1 	 29
           EXAMS 	2 	 85
               = 	3 	 74
             600 	5 	 90
           WHERE 	1 	 27
    STUDENT_NAME 	2 	 85
               = 	3 	 74
         Natalie 	5 	 91
                 	7 	 95
UPDATE statement
Updated 1 rows.

--------WHEN THERE ARE NO NULLS----------
SELECT SUM(Exams) FROM CLASS
dbfile.bin size = 228
          SELECT 	1 	 30
             SUM 	6 	 37
               ( 	3 	 70
           Exams 	2 	 85
               ) 	3 	 71
            FROM 	1 	 26
           CLASS 	2 	 85
                 	7 	 95
SELECT statement
+----------------+
|SUM(Exams)      |
+----------------+
|            5270|
+----------------+
1 rows selected.

SELECT AVG(Exams) FROM CLASS
dbfile.bin size = 228
          SELECT 	1 	 30
             AVG 	6 	 38
               ( 	3 	 70
           Exams 	2 	 85
               ) 	3 	 71
            FROM 	1 	 26
           CLASS 	2 	 85
                 	7 	 95
SELECT statement
+----------------+
|AVG(Exams)      |
+----------------+
|          585.56|
+----------------+
1 rows selected.

------------------------------------------------------------------------------------------
Test COUNT(*), COUNT(Quiz_Total) when there are NULLs. – this should not include NULLS
--------WHEN THERE ARE NO NULLS IN EXAM----------
SELECT COUNT(EXAMS) FROM CLASS
dbfile.bin size = 228
          SELECT 	1 	 30
           COUNT 	6 	 39
               ( 	3 	 70
           EXAMS 	2 	 85
               ) 	3 	 71
            FROM 	1 	 26
           CLASS 	2 	 85
                 	7 	 95
SELECT statement
+----------------+
|COUNT(EXAMS)    |
+----------------+
|               9|
+----------------+
1 rows selected.

--------WHEN THERE ARE NULLS IN EXAM----------
UPDATE CLASS SET EXAMS = null WHERE STUDENT_NAME = 'Natalie'
dbfile.bin size = 228
          UPDATE 	1 	 28
           CLASS 	2 	 85
             SET 	1 	 29
           EXAMS 	2 	 85
               = 	3 	 74
            null 	1 	 16
           WHERE 	1 	 27
    STUDENT_NAME 	2 	 85
               = 	3 	 74
         Natalie 	5 	 91
                 	7 	 95
UPDATE statement
Updated 1 rows.

SELECT COUNT(EXAMS) FROM CLASS
dbfile.bin size = 228
          SELECT 	1 	 30
           COUNT 	6 	 39
               ( 	3 	 70
           EXAMS 	2 	 85
               ) 	3 	 71
            FROM 	1 	 26
           CLASS 	2 	 85
                 	7 	 95
SELECT statement
+----------------+
|COUNT(EXAMS)    |
+----------------+
|               8|
+----------------+
1 rows selected.

SELECT COUNT(*) FROM CLASS
dbfile.bin size = 228
          SELECT 	1 	 30
           COUNT 	6 	 39
               ( 	3 	 70
               * 	3 	 73
               ) 	3 	 71
            FROM 	1 	 26
           CLASS 	2 	 85
                 	7 	 95
SELECT statement
+----------------+
|COUNT(*)        |
+----------------+
|               9|
+----------------+
1 rows selected.

------------------------------------------------------------------------------------------
==========================================================================================
END FUNCTIONAL QUERY - BEGIN ERROR CHECKING
==========================================================================================
==========================================================================================
INSERT ERROR
==========================================================================================
Check syntax errors in various INSERT statement combinations
insert into class values ('Siu', M, 480, 80, 560)
dbfile.bin size = 228
          insert 	1 	 22
            into 	1 	 23
           class 	2 	 85
          values 	1 	 24
               ( 	3 	 70
             Siu 	5 	 91
               , 	3 	 72
               M 	2 	 85
               , 	3 	 72
             480 	5 	 90
               , 	3 	 72
              80 	5 	 90
               , 	3 	 72
             560 	5 	 90
               ) 	3 	 71
                 	7 	 95
INSERT statement
Invalid value

Error in the string: M
rc=-379

insert into class values ('Zeno', 600, 100, 700)
dbfile.bin size = 228
          insert 	1 	 22
            into 	1 	 23
           class 	2 	 85
          values 	1 	 24
               ( 	3 	 70
            Zeno 	5 	 91
               , 	3 	 72
             600 	5 	 90
               , 	3 	 72
             100 	5 	 90
               , 	3 	 72
             700 	5 	 90
               ) 	3 	 71
                 	7 	 95
INSERT statement
Type mismatch

Error in the string: 600
rc=-382

insert into class values ('Zeno', M, '600', 100, 700)
dbfile.bin size = 228
          insert 	1 	 22
            into 	1 	 23
           class 	2 	 85
          values 	1 	 24
               ( 	3 	 70
            Zeno 	5 	 91
               , 	3 	 72
               M 	2 	 85
               , 	3 	 72
             600 	5 	 91
               , 	3 	 72
             100 	5 	 90
               , 	3 	 72
             700 	5 	 90
               ) 	3 	 71
                 	7 	 95
INSERT statement
Invalid value

Error in the string: M
rc=-379

insert into table values
dbfile.bin size = 228
          insert 	1 	 22
            into 	1 	 23
           table 	1 	 14
          values 	1 	 24
                 	7 	 95
INSERT statement
Table table not found

Error in the string: table
rc=-397

insert into class values ('Zeno', 'M', 600, 100, 700) hi
dbfile.bin size = 228
          insert 	1 	 22
            into 	1 	 23
           class 	2 	 85
          values 	1 	 24
               ( 	3 	 70
            Zeno 	5 	 91
               , 	3 	 72
               M 	5 	 91
               , 	3 	 72
             600 	5 	 90
               , 	3 	 72
             100 	5 	 90
               , 	3 	 72
             700 	5 	 90
               ) 	3 	 71
              hi 	2 	 85
                 	7 	 95
INSERT statement
Supposed to be EOC

Error in the string: hi
rc=-199
==========================================================================================
UPDATE ERROR
==========================================================================================
Check syntax errors in various UPDATE statement combinations
update hi SET Student_Name = 'Hi'
dbfile.bin size = 228
          update 	1 	 28
              hi 	2 	 85
             SET 	1 	 29
    Student_Name 	2 	 85
               = 	3 	 74
              Hi 	5 	 91
                 	7 	 95
UPDATE statement
Table hi does not exist

Error in the string: hi
rc=-397

update class SET Student_Name = Hi
dbfile.bin size = 228
          update 	1 	 28
           class 	2 	 85
             SET 	1 	 29
    Student_Name 	2 	 85
               = 	3 	 74
              Hi 	2 	 85
                 	7 	 95
UPDATE statement
Invalid or missing data value

Error in the string: Hi
rc=-379

update class Student_Name = NULL
dbfile.bin size = 228
          update 	1 	 28
           class 	2 	 85
    Student_Name 	2 	 85
               = 	3 	 74
            NULL 	1 	 16
                 	7 	 95
UPDATE statement
Keyword SET is missing

Error in the string: Student_Name
rc=-360

update class SET Student_Name = 'Hi' hi
dbfile.bin size = 228
          update 	1 	 28
           class 	2 	 85
             SET 	1 	 29
    Student_Name 	2 	 85
               = 	3 	 74
              Hi 	5 	 91
              hi 	2 	 85
                 	7 	 95
UPDATE statement
Supposed to be EOC

Error in the string: hi
rc=-360

update class SET Student_Name = 'Three' WHERE
dbfile.bin size = 228
          update 	1 	 28
           class 	2 	 85
             SET 	1 	 29
    Student_Name 	2 	 85
               = 	3 	 74
           Three 	5 	 91
           WHERE 	1 	 27
                 	7 	 95
UPDATE statement
Missing Column in the where clause

Error in the string: 
rc=-360

update class SET Student_Name = Three WHERE Student_Name IS NULL
dbfile.bin size = 228
          update 	1 	 28
           class 	2 	 85
             SET 	1 	 29
    Student_Name 	2 	 85
               = 	3 	 74
           Three 	2 	 85
           WHERE 	1 	 27
    Student_Name 	2 	 85
              IS 	1 	 34
            NULL 	1 	 16
                 	7 	 95
UPDATE statement
Invalid or missing data value

Error in the string: Three
rc=-379

update class SET Student_Name = 'Three' WHERE Student_Name IS NOT NULL
dbfile.bin size = 228
          update 	1 	 28
           class 	2 	 85
             SET 	1 	 29
    Student_Name 	2 	 85
               = 	3 	 74
           Three 	5 	 91
           WHERE 	1 	 27
    Student_Name 	2 	 85
              IS 	1 	 34
             NOT 	1 	 15
            NULL 	1 	 16
                 	7 	 95
UPDATE statement
Invalid relational operator

Error in the string: IS
rc=-377

==========================================================================================
SELECT ERROR
==========================================================================================
select * from
dbfile.bin size = 228
          select 	1 	 30
               * 	3 	 73
            from 	1 	 26
                 	7 	 95
SELECT statement
Error in the string: 
rc=-399

select * from class WHERE
dbfile.bin size = 228
          select 	1 	 30
               * 	3 	 73
            from 	1 	 26
           class 	2 	 85
           WHERE 	1 	 27
                 	7 	 95
SELECT statement
Invalid WHERE syntax

Error in the string: WHERE
rc=-350

select * from class ORDER BY
dbfile.bin size = 228
          select 	1 	 30
               * 	3 	 73
            from 	1 	 26
           class 	2 	 85
           ORDER 	1 	 31
              BY 	1 	 32
                 	7 	 95
SELECT statement
Invalid Column Name or Invalid Order By Syntax

Error in the string: 
rc=-350

select * from class WHERE Gender = M
dbfile.bin size = 228
          select 	1 	 30
               * 	3 	 73
            from 	1 	 26
           class 	2 	 85
           WHERE 	1 	 27
          Gender 	2 	 85
               = 	3 	 74
               M 	2 	 85
                 	7 	 95
SELECT statement
Invalid data value

Error in the string: M
rc=-379

select * from class WHERE Gender = 'M' AND Student_Name = N
dbfile.bin size = 228
          select 	1 	 30
               * 	3 	 73
            from 	1 	 26
           class 	2 	 85
           WHERE 	1 	 27
          Gender 	2 	 85
               = 	3 	 74
               M 	5 	 91
             AND 	1 	 35
    Student_Name 	2 	 85
               = 	3 	 74
               N 	2 	 85
                 	7 	 95
SELECT statement
Invalid data value

Error in the string: N
rc=-379

select * from class WHERE Gender = 'M' BUT Student_Name = 'N'
dbfile.bin size = 228
          select 	1 	 30
               * 	3 	 73
            from 	1 	 26
           class 	2 	 85
           WHERE 	1 	 27
          Gender 	2 	 85
               = 	3 	 74
               M 	5 	 91
             BUT 	2 	 85
    Student_Name 	2 	 85
               = 	3 	 74
               N 	5 	 91
                 	7 	 95
SELECT statement
Invalid Select Syntax

Error in the string: BUT
rc=-350

select * from class WHERE Gender = 'M' AND  = 'N'
dbfile.bin size = 228
          select 	1 	 30
               * 	3 	 73
            from 	1 	 26
           class 	2 	 85
           WHERE 	1 	 27
          Gender 	2 	 85
               = 	3 	 74
               M 	5 	 91
             AND 	1 	 35
               = 	3 	 74
               N 	5 	 91
                 	7 	 95
SELECT statement
Missing column in condition

Error in the string: =
rc=-350

SELECT * FROM CLASS WHERE STUDENT = 'HI'
dbfile.bin size = 228
          SELECT 	1 	 30
               * 	3 	 73
            FROM 	1 	 26
           CLASS 	2 	 85
           WHERE 	1 	 27
         STUDENT 	2 	 85
               = 	3 	 74
              HI 	5 	 91
                 	7 	 95
SELECT statement
The column name is invalid

Error in the string: STUDENT
rc=-393

select * from class where Exams IS NULL or Gender = 'M' ORDER BY LOVE
dbfile.bin size = 228
          select 	1 	 30
               * 	3 	 73
            from 	1 	 26
           class 	2 	 85
           where 	1 	 27
           Exams 	2 	 85
              IS 	1 	 34
            NULL 	1 	 16
              or 	1 	 36
          Gender 	2 	 85
               = 	3 	 74
               M 	5 	 91
           ORDER 	1 	 31
              BY 	1 	 32
            LOVE 	2 	 85
                 	7 	 95
SELECT statement
The column name is invalid

Error in the string: LOVE
rc=-393

==========================================================================================
MISMATCH ERROR ON INSERT
==========================================================================================
insert into class values ('Zeno', 'M', '590', 86, 482)
dbfile.bin size = 228
          insert 	1 	 22
            into 	1 	 23
           class 	2 	 85
          values 	1 	 24
               ( 	3 	 70
            Zeno 	5 	 91
               , 	3 	 72
               M 	5 	 91
               , 	3 	 72
             590 	5 	 91
               , 	3 	 72
              86 	5 	 90
               , 	3 	 72
             482 	5 	 90
               ) 	3 	 71
                 	7 	 95
INSERT statement
Type mismatch

Error in the string: 590
rc=-382

insert into class values ('Zeno', M, 590, 86, 482)
dbfile.bin size = 228
          insert 	1 	 22
            into 	1 	 23
           class 	2 	 85
          values 	1 	 24
               ( 	3 	 70
            Zeno 	5 	 91
               , 	3 	 72
               M 	2 	 85
               , 	3 	 72
             590 	5 	 90
               , 	3 	 72
              86 	5 	 90
               , 	3 	 72
             482 	5 	 90
               ) 	3 	 71
                 	7 	 95
INSERT statement
Invalid value

Error in the string: M
rc=-379

==========================================================================================
NOT NULL ERROR ON INSERT / UPDATE
==========================================================================================
insert into class values (NULL, 'M', '590', 86, 482)
dbfile.bin size = 228
          insert 	1 	 22
            into 	1 	 23
           class 	2 	 85
          values 	1 	 24
               ( 	3 	 70
            NULL 	1 	 16
               , 	3 	 72
               M 	5 	 91
               , 	3 	 72
             590 	5 	 91
               , 	3 	 72
              86 	5 	 90
               , 	3 	 72
             482 	5 	 90
               ) 	3 	 71
                 	7 	 95
INSERT statement
Not Null constraint exists for column name Student_Name

Error in the string: NULL
rc=-380

insert into class values ('Goku', 'M', '590', 86, NULL)
dbfile.bin size = 228
          insert 	1 	 22
            into 	1 	 23
           class 	2 	 85
          values 	1 	 24
               ( 	3 	 70
            Goku 	5 	 91
               , 	3 	 72
               M 	5 	 91
               , 	3 	 72
             590 	5 	 91
               , 	3 	 72
              86 	5 	 90
               , 	3 	 72
            NULL 	1 	 16
               ) 	3 	 71
                 	7 	 95
INSERT statement
Type mismatch

Error in the string: 590
rc=-382

update class SET Student_Name = 'Five' where Quiz_Total IS NULL
dbfile.bin size = 228
          update 	1 	 28
           class 	2 	 85
             SET 	1 	 29
    Student_Name 	2 	 85
               = 	3 	 74
            Five 	5 	 91
           where 	1 	 27
      Quiz_Total 	2 	 85
              IS 	1 	 34
            NULL 	1 	 16
                 	7 	 95
UPDATE statement
Invalid relational operator

Error in the string: IS
rc=-377

==========================================================================================
DATATYPE MISMATCH ON WHERE
==========================================================================================
delete from class where Student_Name = Zeno
dbfile.bin size = 228
          delete 	1 	 25
            from 	1 	 26
           class 	2 	 85
           where 	1 	 27
    Student_Name 	2 	 85
               = 	3 	 74
            Zeno 	2 	 85
                 	7 	 95
DELETE statement
Invalid data value

Error in the string: Zeno
rc=-379

update class SET Student_Name = 'Five' where Quiz_Total = 'Nhu'
dbfile.bin size = 228
          update 	1 	 28
           class 	2 	 85
             SET 	1 	 29
    Student_Name 	2 	 85
               = 	3 	 74
            Five 	5 	 91
           where 	1 	 27
      Quiz_Total 	2 	 85
               = 	3 	 74
             Nhu 	5 	 91
                 	7 	 95
UPDATE statement
Datatype Mismatch

Error in the string: Nhu
rc=-378

==========================================================================================
INVALID DATA VALUE ERRORS
==========================================================================================
update class SET Student_Name = Four
dbfile.bin size = 228
          update 	1 	 28
           class 	2 	 85
             SET 	1 	 29
    Student_Name 	2 	 85
               = 	3 	 74
            Four 	2 	 85
                 	7 	 95
UPDATE statement
Invalid or missing data value

Error in the string: Four
rc=-379

update from class WHERE Student_Name = Four
dbfile.bin size = 228
          update 	1 	 28
            from 	1 	 26
           class 	2 	 85
           WHERE 	1 	 27
    Student_Name 	2 	 85
               = 	3 	 74
            Four 	2 	 85
                 	7 	 95
UPDATE statement
Table from does not exist

Error in the string: from
rc=-397

==========================================================================================
INVALID RELATIONAL OPERATOR
INVALID AGGREGATE FUNCTION PARAMETER
==========================================================================================
select AVG(Student_Name) from class
dbfile.bin size = 228
          select 	1 	 30
             AVG 	6 	 38
               ( 	3 	 70
    Student_Name 	2 	 85
               ) 	3 	 71
            from 	1 	 26
           class 	2 	 85
                 	7 	 95
SELECT statement
Can't apply SUM or AVG to String Column Type

Error in the string: Student_Name
rc=-376

select SUM(Student_Name) from class
dbfile.bin size = 228
          select 	1 	 30
             SUM 	6 	 37
               ( 	3 	 70
    Student_Name 	2 	 85
               ) 	3 	 71
            from 	1 	 26
           class 	2 	 85
                 	7 	 95
SELECT statement
Can't apply SUM or AVG to String Column Type

Error in the string: Student_Name
rc=-376

select TOTAL(Total) from class
dbfile.bin size = 228
          select 	1 	 30
           TOTAL 	2 	 85
               ( 	3 	 70
           Total 	2 	 85
               ) 	3 	 71
            from 	1 	 26
           class 	2 	 85
                 	7 	 95
SELECT statement
Invalid aggregated function or missing column name

Error in the string: TOTAL
rc=-350

select (Total) from class
dbfile.bin size = 228
          select 	1 	 30
               ( 	3 	 70
           Total 	2 	 85
               ) 	3 	 71
            from 	1 	 26
           class 	2 	 85
                 	7 	 95
SELECT statement
Invalid aggregated function or missing column name

Error in the string: (
rc=-350

select SUM(*) from class
dbfile.bin size = 228
          select 	1 	 30
             SUM 	6 	 37
               ( 	3 	 70
               * 	3 	 73
               ) 	3 	 71
            from 	1 	 26
           class 	2 	 85
                 	7 	 95
SELECT statement
Invalid column for SUM

Error in the string: *
rc=-376

select AVG(*) from class
dbfile.bin size = 228
          select 	1 	 30
             AVG 	6 	 38
               ( 	3 	 70
               * 	3 	 73
               ) 	3 	 71
            from 	1 	 26
           class 	2 	 85
                 	7 	 95
SELECT statement
Invalid column for AVG

Error in the string: *
rc=-376

select * from class WHERE Student_Name ? 'Siu' Or Quiz_Total > 80 ORDER BY Quiz_Total
dbfile.bin size = 228
          select 	1 	 30
               * 	3 	 73
            from 	1 	 26
           class 	2 	 85
           WHERE 	1 	 27
    Student_Name 	2 	 85
               ? 	8 	 99
Error in the string: ?
rc=99

delete from class WHERE Student_Name * 'Siu'
dbfile.bin size = 228
          delete 	1 	 25
            from 	1 	 26
           class 	2 	 85
           WHERE 	1 	 27
    Student_Name 	2 	 85
               * 	3 	 73
             Siu 	5 	 91
                 	7 	 95
DELETE statement
Missing relational operator
Error in the string: *
rc=-377

update class SET Exams = NULL WHERE Student_Name * 'Siu'
dbfile.bin size = 228
          update 	1 	 28
           class 	2 	 85
             SET 	1 	 29
           Exams 	2 	 85
               = 	3 	 74
            NULL 	1 	 16
           WHERE 	1 	 27
    Student_Name 	2 	 85
               * 	3 	 73
             Siu 	5 	 91
                 	7 	 95
UPDATE statement
Invalid relational operator

Error in the string: *
rc=-377

update class SET Exams = NULL WHERE Student_Name * 'Siu'
dbfile.bin size = 228
          update 	1 	 28
           class 	2 	 85
             SET 	1 	 29
           Exams 	2 	 85
               = 	3 	 74
            NULL 	1 	 16
           WHERE 	1 	 27
    Student_Name 	2 	 85
               * 	3 	 73
             Siu 	5 	 91
                 	7 	 95
UPDATE statement
Invalid relational operator

Error in the string: *
rc=-377

